{
  "reversalId": "20000000-0000-4000-8000-000000000001",
  "tenantId": "20000000-0000-4000-8000-000000000002",
  "paymentId": "20000000-0000-4000-8000-000000000003",
  "merchantId": "20000000-0000-4000-8000-000000000004",
  "status": "REQUESTED",
  "amount": "25.00",
  "currency": "SAR",
  "aggregateVersion": 0,
  "requestedAt": "2026-08-10T10:00:00Z"
}
